id,title,key
1,集成对抗性机器学习及其应用研究,模型 对抗 攻击 训练 集成 深度 对抗性 样本 使用 策略
2,基于深度学习的遥感图像分类研究,分类 数据 卷积 图像 模型 优化 深度 学习 应用 算法
3,基于机器视觉的黄瓜叶部病害程度检测系统研究,黄瓜 图像 病害 模型 进行 深度 问题 方法 实验 参数
4,基于集成学习方法的药物—靶标相互作用预测及应用,药物 预测 生物 靶标 分子 学习 模型 信息 forest 算法
5,基于稀疏表示的蛋白质相互作用预测及应用,预测 方法 蛋白质 模型 特征提取 矩阵 相互作用 活动 生命 实验
6,基于改进模糊支持向量机的煤与瓦斯突出预测,算法 预测 模型 影响 粒子 突出 参数 机 错误 进行
7,考虑竞争和消费意图的电影首映日票房预测方法,预测 电影 票房 算法 意图 信息 变量 数据 排片 影响
8,高校贫困生管理信息系统设计与研究,模块 贫困学生 扶贫 贫困生 高校 系统 技术 数据 设计 算法
9,基于数据挖掘的电力调度管理系统设计与实现,电力 调度 进行 数据 系统 电网 相关 管理系统 生产 设计
10,基于深度学习的牵引变电所视频图像多目标识别研究,识别 研究 变电所 学习 图像 完成 目标 牵引 巡检 计算能力
11,基于Faster R-CNN的公路路面病害检测算法的研究,检测 公路 算法 进行 病害 方法 故障 问题 学习 减少
12,无人驾驶智能伦理决策研究,决策 无人驾驶 进行 研究 场景 伦理 困境 特征 道路交通 驾驶
13,基于Spark框架的并行林业文本分类算法的研究与实现,分类 林业 算法 文本 数据 并行 研究 进行 计算 信息
14,基于深度学习的植物知识图谱的构建,知识 构建 植物 实体 林业 图谱 研究 语义 信息 领域
15,基于自适应神经模糊推理系统的二氧化碳通量模拟研究,函数 anfis 模拟 rf bpnn 性能 优于 特征选择 平均值 碳
16,桉树立地质量评价与适宜性研究,桉树 研究 模型 评价 系统 算法 数据 进行 方程 构建
17,基于极限学习机的潜热通量插补研究和应用,进行 数据 学习机 通量 参数 研究 潜热 插补 机器 补全
18,神经网络模型在碳通量数据模拟的研究与应用,模型 神经网络 模拟 数据 通量 特征 技术 进行 一致性 因子
19,基于多源遥感与机器学习的密云水库水质参数反演研究,水质 密云水库 反演 算法 回归 regressor 水源地 方面 保护 浓度
20,校园网安全情报管理系统,实现 情报 校园网 安全 进行 服务器 网络安全 日志 信息 信息化
21,X教育公司大数据营销智能推荐系统的研究,用户 营销 官网 官 实现 课程 购课 系统 体验式 推荐
22,基于少数类过采样的马尾松毛虫发生面积等级预测算法及应用,预测 算法 虫害 样本 数据 提供 马尾松 工作 模型 特征
23,基于机器学习的漂浮大型藻类遥感研究,数据 藻类 暴发 算法 变化 海洋 精度 光谱 mlp 卫星
24,基于机器学习算法的日喀则地区泥石流易发性研究,泥石流 因子 进行 结果表明 方法 研究 日喀则地区 神经网络 分析 som
25,基于机器学习多维度的海面能见度研究,预测 能见度 海域 海面 空间 bp 进行 模型 实验 插值
26,基于近似牛顿法的分布式深度学习,训练 分布式 数据 网络 法 进行 优化 研究 问题 运行
27,基于深度学习算法的评论情感分析研究,学习 向量 分析 评论 神经网络 模型 特征 方法 文本 需要
28,量子特征选择与量子感知机算法研究,算法 量子 计算 学习 效率 机器 数据 经典 研究 特征选择
29,基于集成学习的不平衡数据分类算法应用研究,样本 算法 模型 进行 数据 分类 不 应用 预测 采样
30,语音情感的特征提取和分类方法研究,语音 情感 进行 识别 研究 方法 分类 模态 特征 性能
31,易跌倒步态特征及其预警技术研究,步态 进行 跌倒 实现 步行 采集 系统 运动 数据 研究
32,面向深度学习应用的可视化编程系统的研究与实现,算法 编程 可视化 学习 模型 深度 方式 数据处理 图 计算
33,基于多源遥感数据的森林地上生物量估算研究,估算 数据 精度 森林 进行 模型 生物量 回归 特征 利用
34,基于神经网络量子态的横场Ising模型研究,波函数 计算 方法 量 基态 使用 横场 参数 sr 会
35,人工智能在金融领域的应用研究,金融 人工智能 风险 智能 应用 发展 监管 投资 融合 技术
36,基于时序数据的音乐流媒体用户流失预测,模型 特征 用户 流失 学习 进行 预测 lstm 利用 音乐
37,网络化无创血压智能监测系统的研究与设计,血压 信号 生理 模型 特征 参数 人体 监测 学习 疾病
38,基于心电的车载健康监护系统的设计与实现,分析 进行 驾驶 采集 模块 方法 提取 数据 波 监测
39,基于机器学习的乳腺癌风险分析与预测研究,乳腺癌 患者 模型 数据 预测 大 技术 影响 算法 研究
40,票房预测中的社交网络评论情感挖掘技术研究,电影 情感 影评 模型 票房 特征 主题 观众 预测 使用
41,基于极限学习机理论的多楼层定位算法研究,学习 算法 用于 性能 楼层 训练 rssi elm 阶段 pca
42,异构网络中基于机器学习的网络选择算法,网络 用户 选择 属性 算法 遗传算法 接入 提出 技术 业务
43,不完整数据集下基于极限学习机的室内定位算法研究,算法 训练 位置 定位 学习 理论 指纹 阶段 攻击 函数
44,基于机器学习的无线通信场景分类方法,分类 无线通信 场景 进行 研究 技术 信道 相关 算法 时间
45,基于可穿戴设备的人体姿态识别研究及系统设计,人体 识别 进行 算法 服务 系统 领域 设备 研究 技术
46,基于单个RGB摄像头的虚拟键盘系统研究,进行 虚拟 算法 键盘 用户 指尖 人机交互 利用 手部 研究
47,基于机器学习的手势识别技术研究,手势 识别 模型 进行 技术 研究 实现 卷积 分割 数据
48,基于信任传递的智能推荐方法研究,用户 推荐 信任 方法 物品 问题 系统 冷启动 人们 互联网
49,基于智能终端的行为识别方法研究,识别 检测 活动 数据 准确率 提高 行为 研究 算法 进行
50,基于机器学习的网络舆情情感倾向分析研究,技术 研究 文本 情感 进行 分析 倾向 载体 舆情 词库
51,基于支持向量机的网络流量分类技术研究,分类 流量 提升 方法 训练 利用 支持 机 改进 样本
52,基于机器学习的异常DNS流量检测研究,进行 dns 网络 使用 域名 检测 过滤 ip地址 中 流量
53,组稀疏多任务学习方法及其应用研究,任务 方法 特征 模型 信息 情况 利用 学习 组 化项
54,持续学习框架中主动学习算法研究,数据 学习 算法 标注 分类器 性能 分类 样本 clbss 进行
55,基于机器学习的生物医学命名实体识别的研究,生物医学 实体 出 文献 特征 算法 识别 数据 研究 方法
56,基于机器学习的智能高考志愿推荐系统,考生 专业 方法 推荐 个性化 文本 志愿 词 存在 语义
57,基于脑电的情绪识别研究与系统开发,情绪 模块 特征 提取 研究 脑 识别 脑电 机器 学习
58,基于蜻蜓算法和花朵授粉算法的特征选择方法研究,数据 算法 进行 应用 特征选择 技术 蜻蜓 信息 方法 对比
59,基于机器学习的行人姿态估计及识别的算法研究,行为 分类 视频 特征 识别 模型 人体 完成 应用 算法
60,机器学习方法在上市公司财务舞弊预测问题中的应用,模型 进行 舞弊 公司 财务报表 数据 上市公司 预测 是否 建立
61,基于机器学习的电网调控云防误系统研究与应用,防误 进行 系统 运行 调控 构建 电网 研究 误操作 操作
62,再次剖宫产术中出血危险因素分析及机器学习对术中输血预测研究,出血 临床 中 麻醉 剖宫产 术 病历 患者 预测 输血
63,数据驱动的物联网安全威胁检测与建模,安全 物 设备 知识 数据 研究 联网 检测 流量 分析
64,基于推理机和GBDT的企业赊销信用风险研究,赊销 企业 模型 客户 进行 研究 管理 分析 数据 理论
65,基于大数据平台的恶意IP分类算法研究,算法 售票 分类 数据 策略 恶意 购票 选取 研究 分类器
66,基于GPS定位数据的出行行为研究,数据 出行 识别 中 研究 信息 算法 居民 gps 利用
67,面向气象数据监控系统的优化设计与研究,气象 数据 系统 监控 进行 信息 方面 关系 设计 研究
68,基于大数据平台相关技术下的银行个人客户信用风险评估,数据 银行 发展 技术 模型 个人 研究 进行 大 信用风险
69,基于骨架点分割算法的文本验证码攻击模型的研究,字符 验证码 识别 模型 分割 算法 传统 输出 设计 实验
70,网络垃圾信息识别方法研究,模型 进行 信息 层 效果 词 文本 新 方法 研究
71,基于遗传算法的P2P网贷违约预警模型研究,数据 模型 优化 研究 分析 违约 行业 平台 监管 网贷
72,基于卷积神经网络的交通方式识别研究,数据 识别 研究 出行 gps 分析 方式 进行 具有 模型
73,基于神经网络的电子病历实体识别,模型 进行 识别 医学 实验 crf 病历 实体 f1 采用
74,基于分子描述符的中草药化合物类药性预测及应用研究,中草药 进行 化合物 预测 混合 研究 数据库 分析 筛选 配方
75,基于机器学习的线路跳闸预警研究,线路 数据 预测 学习 方法 跳闸 算法 特征 电网 进行
76,基于深度学习的肝脏疾病诊断,学习 特征 诊断 神经网络 结构 训练 模型 医学 进行 疾病
77,基于多策略的高校助学金精准预测的研究与应用,模型 高校 算法 助学金 学生 资助 数据 进行 gbdt 帮助
78,基于改进机器学习方法的股票预测研究,预测 投资 收盘价 股票 算法 使用 股价 参数 模型 进行
79,基于网络行为的用户画像算法研究,用户 算法 预测 数据 特征 画像 模型 属性 研究 方法
80,基于深度学习的风功率预测模型的研究,预测 风电场 数据 模型 研究 功率 进行 学习 网络 凝冻
81,基于语义分析的铁路车载无线通信设备故障分析与预测,设备 数据 cir 分析 进行 使用 模型 状态 数据分析 铁路
82,基于机器学习的多特征融合室内定位的研究,算法 定位 融合 特征 rssi 技术 模型 进行 移动 优化
83,基于大数据的铁路道岔缺口监测分析研究,铁路 分析 研究 监测 进行 实现 设备 数据 平台 智能
84,CT影像组学在胃癌诊断及病理分型中的可行性研究,特征 胃癌 进行 诊断 病理 ct 分析 组织 腺癌 能量
85,低速碰撞下汽车吸能盒结构优化设计,盒 吸能 碰撞 结构 分析 方法 优化 性能 能量 建立
86,面向家庭服务机器人指令深层信息提取,信息 进行 实体 提取 指令 识别 人们 机器人 服务 实现
87,基于小波神经网络与支持向量机的股票预测及优化,预测 数据 股票 算法 wnn 模型 神经网络 金融 方法 理论
88,非平衡化标记补全的多标记学习及其应用,标记 学习 进行 矩阵 利用 相关性 分类 样本 信息 特征
89,基于多示例多标记的多领域数据分类,算法 miml 学习 分类 elm 退化 learning cnn 示例 中
90,基于混合核极限学习机的标记学习研究及应用,算法 标记 数据 中 学习机 使用 提升 处理 性别 混合
91,基于PCA和BP神经网络的信息安全模型研究,信息安全 防御 攻击 安全 检测 算法 数据 传统 技术 方法
92,基于Kinect骨骼信息的人体动作识别方法研究,人体 动作 特征 运动 关节 识别 方法 数据 投影 去
93,基于高斯过程的偏微分方程数值解法构造,过程 模型 数值 概率分布 函数 微分方程 未知 线性 高斯 问题
94,上证50ETF期权市场中的交易策略设计,价格 期权 方法 定价 策略 市场 交易 理论 投资者 公式
95,基于深度学习的机载点云分类研究,分类 特征 进行 城市 方法 数据 组合 提取 邻域 云
96,人工智能生成物著作权保护问题探究,人工智能 著作权法 进行 生成物 问题 发展 著作权 理论 保护 作品
97,量化选股智能建模及参数优化研究,预测 elm 模型 pca 进行 趋势 建模 数据 投资 算法
98,无线传感器网络故障检测算法的研究,网络 节点 进行 数据 检测 传感器 预测 故障 算法 可靠性
99,基于互联网金融下的信贷逾期预测的研究,模型 特征 预测 数据 用户 建立 分析 信息 离散 值
100,基于深度学习的人脸识别研究,模型 网络 人脸识别 导致 人脸 特征 训练 识别 选择 技术
101,基于数据挖掘算法的微信公众号阅读量分析,模型 公众 量 微信 进行 算法 媒体 发文 研究 策略
102,基于机器学习的智能临床决策方法研究,方法 患者 治疗 学习 信号 临床 记录 特征提取 具有 相互作用
103,面向心血管疾病识别的心电信号分类研究,信号 进行 分类 模型 疾病 心血管 特征 波 数据 算法
104,基于回归模型CRRT手术中肝素剂量预测,模型 算法 进行 采用 医生 肝素 crrt 数据 处理 剂量
105,冬笋探测器的设计,进行 探测 设计 探测器 冬笋 研发 信号源 检测 模块 硬件
106,目的论视角下的科普文本翻译,翻译 科技 目的论 文本 分析 论文 原文 旨在 译者 信息
107,基于深度学习的新闻文本分类模型研究,模型 文本 分类 新闻 研究 学习 句子 语义 数据 简化
108,基于机器学习的精神科量表工具优化及应用,量表 优化 中 ade 诊断 得到 使用 障碍 人们 双相
109,Lstm Based Short Message Service(SMS) Modeling for Spam Classification,垃圾邮件 方法 问题 sms 向量 svm 现代 进行 研究 服务
110,基于EEMD_LSTM模型的沪深300指数预测研究,模型 预测 股票市场 eemd 数据 理论 函数 模量 周期 方法
111,基于知识与数据共同驱动的移动用户支付行为识别研究,支付 识别 用户 移动 模型 利用 数据 行为 方法 知识
112,融合行为金融学的机器学习选股算法研究及应用,进行 算法 数据 模型 预测 学习 金融 中 操作 股票
113,基于RBM模型和LFM模型的推荐算法研究与实现,推荐 模型 用户 问题 进行 信息 算法 数据 协同 评分
114,基于计算机视觉的驾驶员行为分析系统设计,驾驶员 检测 进行 实现 人脸 行为 系统 特征 环境 运行
115,基于机器学习的含蜡原油管道蜡沉积预测算法研究,蜡 模型 进行 实验 原油 沉积 优化 预测 管道 支持
116,基于深度学习的树种识别算法研究,识别 模型 图像 学习 进行 数据 树种 训练 方式 研究
117,基于统计学方法的朝鲜语大数据文本挖掘研究,数据 进行 研究 信息 人们 朝鲜语 建立 文本 挖掘 统计学
118,基于机器学习的北京市快递网点布局研究,网点 研究 布局 利用 学习 模型 北京市 数据 机器 进行
119,微博舆情的情感分析与社会动员,情感 动员 社会 分析 研究 传播 元素 事件 引发 欢案
120,共享单车情境下的公交出行研究,影响 选择 出行 人们 进行 共享 模式 单车 分类 新
121,基于机器学习分类算法的微博恶意用户识别研究,用户 算法 特征 信息 识别 进行 人们 分类 实验 程序
122,石林巴江流域径流过程对气候及土地利用变化的响应研究,流域 变化 趋势 研究 径流 模型 岩溶 径流量 巴江 水资源
123,基于数据驱动的生活用纸物理特性预测及其打浆工艺优化,模型 生活 算法 数据 用纸 建立 打浆 磨浆 gbdt 预测
124,基于大数据的公交线网速度预测模型研究,数据 进行 预测 模型 研究 分析 问题 算法 影响 提供
125,机器学习在蛋白质磷酸化、硝基化和硫化位点识别中的应用研究,磷酸化 进行 真菌 蛋白质 预测 方法 修饰 酪氨酸 特征 位点
126,《机器学习—新型人工智能》（节选）翻译实践报告,翻译 问题 发展 信息 学习 法 笔者 实践 机器 科技
127,基于boosting模型的逆向投资策略研究,模型 策略 进行 收益率 指标 回测 优化 训练 组合 市场
128,基于机器学习的急性肾损伤预测及临床应用优化,进行 患者 急性 预测 指标 算法 应用 临床 诊疗 医疗
129,大规模物联网设备组织信息的发现与提取,物 信息 设备 组织 技术 研究 安全 识别 联网 信息提取
130,产品评论的方面级观点挖掘技术研究,情感 产品 评价 进行 方法 研究 分类 评论 规则 达到
131,基于深度学习的交通流量预测,预测 特征 方法 交通流量 交通 信息 利用 提取 空间 网络
132,基于NSGA-Ⅱ算法及机器学习的压水堆组件装载方案优化研究,优化 算法 研究 组件 模型 预测 方案 中子 内 nsga
133,非肌层浸润性膀胱癌组织干性调控机制研究,干性 基因 研究 nmibc 患者 进行 组织 表达 进展 调控
134,视频用户QoE的感知和预测,视频 qoe 用户 采用 方法 运营商 进行 适应 网络流量 abr
135,基于机器学习的室内射频指纹定位技术研究,指纹 射频 定位 特征 时间 信号 无线 具有 定位系统 提出
136,大规模基站网络流量模式挖掘和预测,基站 模式 流量 预测 测量 聚类 方法 模型 进行 分析
137,少模光纤模分复用系统非线性均衡技术研究,算法 系统 传输 模式 knn 进行 光纤 损伤 耦合 研究
138,基于TDM-PON和C-RAN架构的休眠感知资源分配研究,网络 ran 研究 问题 rrh 网络资源 资源管理 资源分配 学习 能量
139,基于词典与改进信息增益的微博情感分析,算法 情感 信息 网络 特征 进行 词典 效果 研究 分析
140,基于电子产品领域商品评论的情感分析方法研究和实现,进行 评论 分类器 方法 新词 产品 分类 提取 算法 文本
141,面向网络评论短文本的情感分析研究与实现,情感 新词 评论 网络 背景 模型 分析 进行 发现 当今
142,推荐系统中动态推荐算法研究,算法 推荐 问题 用户 新闻 动态 技术 模型 提出 物品
143,基于扰动的网络流量数据隐私保护方法研究,数据 算法 属性 网络流量 数据挖掘 分类 原始数据 保护 泄露 方法
144,标识网络中基于多维属性的服务管理机制研究与实现,服务 属性 网络 进行 标识 研究 信息 生成 区域 具有
145,基于知识追踪的智能导学算法设计,学生 模型 习题 知识 题目 推荐 提升 设计 学习 特征
146,基于机器学习算法的精神分裂症听觉稳态诱发脑电研究,核 精神分裂症 模型 算法 脑 诊断 分类 电信号 roc 学习
147,基于半监督学习的医嘱辅助决策方法研究,患者 医嘱 数据 方法 诊疗 辅助 研究 信息 结合 学习
148,基于Twitter社交网络数据的流感预测应用研究,流感 数据 预测 算法 分类 模型 进行 趋势 可视化 时间
149,无线传感网络中的数据融合研究,数据 节点 聚类 传感器 预测 特征 距离 模型 融合 传输
150,空分复用弹性光网络中资源分配策略研究,网络 策略 业务 资源 碎片 频谱 阻塞 整理 带宽 业务量
151,基于机器学习分类算法和数据库的频谱感知,su 感知 pu 频谱 指纹 检测 分类器 利用 研究 性能
152,基于深度学习的电商产品评论情感分析研究,迁移 情感 模型 领域 文本 卷积 向量 信息 记忆 学习
153,基于深度学习的多模型融合文本情感算法研究,情感 进行 评论 模型 算法 词 分析 特征 数据 向量
154,面向概念漂移和不均衡数据流的分类算法研究,数据流 概念 算法 分类 分类器 分析 挖掘 大量 检测 漂移
155,基于集成学习的偏标记学习算法研究,数据 进行 学习 标记 问题 框架 特征 处理 算法 编码
156,智能电网中虚假数据注入攻击检测研究,数据 检测 elm cnn fdi 攻击 中 卷积 提高 系统
157,基于机器视觉的羽毛球发球违例检测系统设计与实现,发球 目标 实现 技术 人工智能 判决 违例 羽毛球 状态 检测
158,基于骨骼点的人体运动识别系统的设计与实现,技术 设计 运动 采集 人体 进行 数据 系统 分类 识别
159,基于MCP惩罚的AdaBoost集成剪枝技术的研究,使用 进行 模型 集成 adaboost 剪枝 数据 预测 mcp 效果
160,支持向量回归在高频金融时间序列中的应用研究,模型 研究 参数 进行 算法 预测 支持 学习 数据 改进
161,基于多源数据的用户体验分析研究,用户 软件 体验 分析 方法 评估 算法 样本 改进 迁移
162,方差正则化的交叉验证模型选择方法研究,模型 选择 估计 验证 分类 方差 统计 传统 进行 性能
163,机器学习技术在声波逆散射问题中的应用,算法 研究 深度 问题 数据 学习 数值 方法 领域 逆
164,基于决策森林的蛋白质二级结构预测算法研究,蛋白质 预测 模型 算法 数据 进行 特征 研究 样本 森林
165,机器学习方法在临近降雨预报中的应用研究,方法 预报 降雨 雷达 模型 xgboost 实验 进行 临近 产品
166,基于Sentinel-1的南极冰盖冻融探测方法研究,数据 方法 变化 探测 sentinel 冰盖 应用 分析 信息 精度
167,手性化合物的比旋光度预测及绝对构型自动识别,描述符 预测 定量 中 变量 化合物 rf 进行 比旋光 映体
168,基于深度学习的矿用地磅车牌识别研究,车牌 进行 矿用 识别 学习 研究 网络 运输 车辆 煤炭
169,基于SVM矿井环境无线多模信号的检测识别,svm 信号 分类器 识别 矿井 环境 进行 衰落 研究 问题
170,基于信息融合的综采工作面瓦斯浓度预测研究,进行 预测 浓度 得到 组合 工作面 工作 煤矿 svr 回归
171,晋中盆地土壤重金属污染特征分析,污染 土壤 含量 重金属 pb cd 分析 盆地 hg 影响
172,基于卷积神经网络的荒漠化草原草种分类研究,分类 进行 波段 图像 草原 高 方法 输入 课题 利用
173,基于对象分割的卫星图像中物体变化检测与识别算法研究,建筑物 算法 变化 变化检测 数据 影像 检测 图像 识别 net
174,基于高光谱图像分析的地物变化检测方法研究,变化检测 地物 研究 方法 高 光谱 图像 学习 目标 检测
175,基于深度卷积神经网络的变转速行星齿轮箱故障诊断方法研究,故障 进行 智能 训练 行星 诊断 能够 信号 模型 转速
176,基于卷积神经网络的机械故障诊断域自适应算法研究,故障诊断 数据 网络 算法 进行 生成 学习 问题 采集 差异
177,非均衡数据驱动的重载铁路列车智能控制算法,列车 数据 模型 实现 制动 方式 重载 算法 列车运行 控制
178,铁路场景下卫星定位可用性评估及预测方法研究,卫星 可用性 进行 环境 场景 预测 铁路沿线 遮挡 定位 研究
179,基于数据的城轨乘客路径选择与客流拥堵动态估计研究,进行 客流 模型 方法 学习 选择 路径 利用 聚类 路网
180,列控车载设备故障间隔时间统计分布建模及预测方法研究,故障 预测 设备 模型 研究 进行 车载 分析 分布 组合
181,基于交叉熵理论的列控车载设备故障组合预测方法研究,故障 预测 车载 数据 状态 进行 分析 设备 方法 识别
182,大型活动下城市轨道交通进出站客流短时预测研究,进行 客流 预测 模型 特征 方法 构建 活动 组合 提出
183,机器学习在高速铁路光传送网的应用研究,故障 网络 业务 进行 光 链路 信息 神经网络 qos svm
184,轨道动检数据的时序预测模型研究,数据 预测 桥梁 进行 时间 铁路 实现 cp 神经网络 技术
185,基于多模态融合的特种车辆识别的研究与应用,车辆 识别 数据 特种 模态 技术 无人驾驶 实现 融合 应用
186,基于LSTM深度神经网络的短期交通流预测,模型 预测 进行 error 神经网络 交通流 问题 核心 误差 absolute
187,基于神经网络的道路通行时间预估方法的设计与实现,数据 交通 方法 模型 出行 道路 采用 论文 预估 进行
188,基于GMM模型与RWI-HLLE算法的高速公路运行状态评价,高速公路 算法 进行 评价 分析 运行 状态 数据 识别 交通
189,无人驾驶感知辅助系统的研究与仿真实现,系统 无人驾驶 视觉 提取 感知 检测 会 实现 使用 驾驶
190,复杂情况下的道路边缘检测算法研究,道路 算法 进行 阴影 驾驶 拟合 车辆 利用 影响 图像
191,基于单线激光雷达的车辆检测与跟踪,进行 识别 车辆 分类 分类器 采用 激光雷达 目标 实验 分析
192,陕西某水库坝基岩体质量评价及抗剪断强度参数预测研究,岩体 工程 参数 预测 面 估算 坝址 研究 水库 坝基
193,机器学习在室内智能照明工程中的应用研究,照明 利用系数 灯具 使用 进行 法 模型 优化 计算 方法
194,基于支持向量机的出厂水水质控制方法的研究,水质 控制 水厂 加药 出厂 模型 效果 进行 采用 建立
195,高精度饮用水质参数自动监测方法与应用研究,水质 系统 进行 数据 饮用水 安全 问题 监测 设计 水厂
196,基于数据挖掘的电力客户投诉分析与预测研究,投诉 服务 电力 客户 客户服务 数据 文本 预测 工单 提升
