id,title,key
970,机器学习程序错误分析及其检测技术研究,程序 突变体 测试 机器 检测 错误 统计 区分 学习 代码
971,燃气管道腐蚀评估系统的设计与实现,腐蚀 技术 系统 方法 数据 分析 燃气管 介绍 燃气 评估
972,燃气管道风险预测方法的研究与实现,燃气管 预测 模型 管道 数据 燃气 风险 技术 方法 研究
973,面向特定场景的移动网络质量评估方法的研究和实现,评估 进行 移动 方法 算法 场景 部分 网络 研究 数据
974,基于应用行为特征的多任务协同调度瓶颈分析系统的研究与实现,应用 进行 系统 分析 任务调度 特征 状态 模式 学习 优化
975,面向云服务的服务协同与负载均衡策略的设计与实现,服务 负载 设计 性能 架构 模型 策略 中心 动态 问题
976,花生米品质分选系统的关键技术研究,花生米 研究 特征 方法 分类器 进行 品质 算法 颜色 方面
977,基于计算机视觉的甘蔗茎节识别技术研究,甘蔗 技术 图像 进行 方案 研究 定位 边缘 线性 部位
978,基于AdaBoost模型的藏文文本分类研究与实现,分类 模型 研究 算法 特征 实验 文本 文献 藏文 进行
979,虚拟光网络映射算法研究,网络 算法 资源 链路 需要 映射 需求 频谱 排序 路径
980,下行非正交多址接入系统中干扰用户动态参数检测技术研究,算法 中 采用 检测 方式 技术 干扰 性能 用户 信号
981,基于机器学习的社交网络信息过滤及推荐系统实现,信息 用户 社交 情感 推荐 词 算法 模型 特征 进行
982,基于光纤光栅的人体上肢姿态柔性检测与识别研究,姿态 进行 实验 上肢 人体 角度 识别 关节 测量 光栅
983,建筑结构表面风压非高斯特性分析方法研究,模拟 风压 方法 极值 过程 统计 估计 简称 算法 时变
984,基于大数据和机器学习的转子间骨折新型三维分型系统的构建及评估研究,骨折 转子 进行 股骨 术后 复位 实现 线 患者 数据
985,复杂海况下海面弱目标的精准与智能探测研究,智能 海洋 检测 海况 特征 检测器 目标 问题 利用 信号
986,共享短租中房客信任影响因素及信任传递研究,房东 房客 信任 进行 研究 影响 文本 模型 情感 方法
987,基于非线性优化建模的激光诱导击穿光谱定量分析方法,光谱 libs 优化 元素 方法 中 分析 回归 高温 技术
988,合金元素对半连铸7×××铝合金微观组织和热裂敏感性的影响研究,合金 热裂 预测 相图 晶粒 研究 影响 质量 扩展 添加
989,移动边缘计算任务迁移与资源管理研究,系统 计算 边缘 方案 网络 任务 处理 资源管理 提出 协作
990,基于组稀疏的子集选择应用研究,方法 任务 核 数据 代表性 函数 信息 优化 聚类 得到
991,基于超限学习机的无设备定位方法研究,elm 方法 噪声 dfl 无线 分布 提出 建模 实现 区域
992,基于语义时空数据的人类移动性预测,预测 活动 建模 个体 位置 模型 方法 研究 数据 语义
993,机器学习在量子物理学中的应用,神经网络 利用 学习 量子 基态 物理学 算法 机器 波函数 计算
994,基于可编程网卡的高性能数据中心系统,性能 fpga 网络 高 实现 clicknp 可编程 网卡 数据中心 内存
995,强热带气旋及大规模断电影响下的孕妇健康风险及脆弱性研究,飓风 研究 断电 风险 影响 妊娠 孕妇 脆弱性 评估 方法
996,基于全国卒中筛查数据的卒中风险预测及经济负担模拟研究,筛查 算法 模型 人群 因素 经济负担 研究 进行 风险 干预
997,深度学习在乳腺癌磁共振诊断的探索性研究,乳腺 乳腺癌 诊断 进行 模型 图像 肿瘤 例 方法 胆碱
998,针对若干数据挖掘问题的量子算法研究,算法 量子 计算 数据挖掘 密码 经典 估计 挖掘 数据 统计学
999,基于深度学习的城市尺度无线流量预测,预测 进行 流量 网络 学习 数据 提升 城市 能够 跨域
1000,MOOC讨论区讨论深度评价模型研究,模型 影响 特征 mooc 深度 进行 讨论 问题 课程 评价
1001,语音与文本在情感识别中的比较研究,情感 语音 识别 文本 信息 进行 特征 研究 分析 发现
1002,基于多模型的问答社区答案质量评价研究,答案 文本 特征 计算 问题 挖掘 主题 模型 评价 分类
1003,多模态特征融合的情感识别研究,语音 识别 情感 特征 进行 融合 文本 模型 用于 研究
1004,基于深度学习的信贷违约识别方法的研究,数据 模型 算法 进行 学习 交易 信贷 方面 分类 深度
1005,基于机器学习的理财产品推荐算法的研究,理财产品 推荐 用户 召回 时间 金融 基金 个性化 银行 互联网
1006,基于深度学习的连锁便利店销量预测的研究与应用,便利店 预测 相关 进行 商品 研究 销量 组合 因素 系统
1007,数据挖掘在智能手机销售数据中的应用,手机 进行 算法 参数 销量 网络 销售 数据 问题 网站
1008,基于BP_Adaboost改进算法的电影首轮融资时总票房分类预测研究,电影 算法 预测 bp 电影票房 模型 时 分类 进行 mea
1009,基于机器学习的移动视频QoE评价方法研究,视频 模型 移动 qoe 质量 特性 参数 进行 评价 客户端
1010,基于移动最小二乘法的小区均价预测模型研究,数据 特征 进行 小区 模型 研究 使用 住宅 均价 提出
1011,基于XGBoost方法的ND公司门店销售预测研究,门店 数据 特征 进行 预测 销售 模型 缺失 xgboost 出行
1012,路面裂缝检测与识别分类研究及FPGA实现,裂缝 检测 图像 进行 系统 实现 路面 信息 算法 分类
1013,基于机器学习算法的风机叶片结冰预测,风力 模型 法 叶片 结冰 进行 特征 数据 方案 问题
1014,基于深度学习的电力系统扰动后动态频率特征预测,电力系统 频率 系统 数据 方法 预测 利用 特征 学习 神经网络
1015,日喀则地区滑坡泥石流孕灾环境遥感监测研究,数据 灾害 环境 分析 研究 因子 监测 学习 变化 算法
1016,基于机器学习的京津冀地区PM_(2.5)浓度及能见度预报,预报 能见度 pm 京津冀 进行 分析 发展 污染 模型 气象
1017,基于机器学习的麦克风阵列声源定位算法研究,doa 定位 进行 music 信号 声源 算法 学习 函数 语音
1018,基于微博文本的暴雨内涝灾情判别与舆情研究,进行 暴雨 判别 造成 灾害 媒体 分类 灾情 微 时效性
1019,原发性失眠病辨证算法优化研究,权值 因子 原发性 辨证 研究 症状 优化 进行 证型 失眠病
1020,基于主动学习与半监督学习的交通方式识别模型与应用,数据 交通 出行 特征 信令 方法 研究 学习 进行 识别
1021,基于集成学习的信用评分模型应用研究,模型 方法 学习 问题 评分 构建 信用 风险 贝叶斯 解释性
1022,基于改进FSVM的滚动轴承故障诊断研究,故障 方法 分解 算法 进行 噪声 聚类 滚动轴承 信号 问题
1023,太赫兹光谱自动特征提取及识别研究,太 模型 光谱 特征 数据 识别 方法 利用 自动 进行
1024,基于广义回归神经网络的网页排序学习研究,进行 数据 排序 模型 广义 用户 神经网络 学习 网页 使用
1025,健康领域中文自动问答的问题解析研究,问题 标注 构建 解析 研究 实现 进行 肺癌 模型 领域
1026,基于神经网络的事件时序关系识别方法研究,神经网络 事件 方法 关系 信息 研究 识别 进行 时序 联合
1027,双子空间迁移学习方法的跨库语音情感识别,情感 方法 空间 分布 差异 特征 语音 识别 提出 进行
1028,疾病名称识别和规范化,疾病 生物医学 信息 规范化 识别 实验 名称 问题 模型 抽取
1029,校正最大化偏差的异策略强化学习方法研究,算法 策略 偏差 方法 学习 最大化 问题 learning 使用 收敛
1030,基于深度学习的有毒重气点源扩散浓度实时预测研究,模型 预测 cnn 进行 扩散 学习 cfd 数据 氯气 有毒
1031,面向表面缺陷检测的小样本机器学习方法研究,检测 进行 模型 中 缺陷 学习 样本 数据 特征 网络
1032,基于生物信息学的温脾汤治疗慢性肾病的活性成分虚拟筛选研究,化合物 筛选 模型 活性 药物 靶点 构建 通路 人参 中
1033,基于力和振动融合的刀具磨损状态辨识方法研究,刀具 磨损 进行 试验 信号 模型 辨识 生产 工件 振动
1034,半监督稀疏拉普拉斯支持向量机研究,机 样本 数据 中 实现 l1 方法 研究 学习 算法
1035,基于机器学习的胃食管反流病中医证候分类的应用研究,胃 gerd 中医 证候 临床 方法 辨证 分布 运用 应用
1036,气道内窥OCT图象分割算法研究,分割 气道 图像 边界 算法 oct 疾病 方法 死亡率 图论
1037,基于机器学习的气象因素对小麦产量影响的分析预测,预测 小麦 气象 回归 模型 算法 数据 进行 产量 研究
1038,农业舆情监测与分析系统研究,舆情 农业 社交 进行 研究 网络 分析 词典 系统 利用
1039,基于LDA的煤矿事故调查报告主题发现研究,主题 事故 进行 挖掘 信息 隐患 调查报告 煤矿 文档 煤矿安全
1040,光电成像系统激光干扰效果分析与评估技术研究,算法 干扰 目标 激光 方法 图像 遮挡 信息 评估 光斑
1041,淀粉相变人工智能监控体系的构建及应用研究,淀粉 研究 检测 体系 进行 行为 相变 形态 变化 特性
1042,基于表情识别的交互康复训练系统,系统 情绪 交互 特征 算法 运算 表情 信息 康复训练 识别
1043,基于机器学习的股市行业轮动量化投资策略研究,市场 模型 学习 行业 策略 投资者 交易 机器 因子 量化
1044,基于~1H-NMR和机器学习的檀香、沉香快速识别模型建立及化学组成分析,模型 檀香 算法 进行 决策树 黄檀 利用 化合物 鉴别 质谱
1045,基于机器学习的车辆行程时间影响因素分析及预测,进行 分析 车辆 模型 特征 数据 时间 影响 汽车 预测
1046,基于机器学习的金融产品推荐算法研究,用户 推荐 进行 模型 特征 方法 物品 社交 举足轻重 行业
1047,基于语义分割的单木三维重建与参数提取,枝干 提取 方法 参数 分割 树木 研究 用于 analysis 尺度
1048,基于机器学习的教学评价模型的研究与实现,评价 教学 数据 算法 方法 学习 模型 分类 过程 属性
1049,融合词汇语义的深度学习电子病历诊断模型研究,模型 emr 知识 向量 lsv cnn 深度 问题 词汇 进行
1050,基于深度学习模型的表面肌电信号手势动作识别算法研究,semg 信号 具有 模型 进行 算法 实验 深度 识别 电信号
1051,基于深度学习的跨语言文本情感分类技术研究,语言 特征 情感 双语 方法 分类 语料 文本 跨 网络
1052,基于对抗训练的文本情感分析研究,情感 文本 对抗 鲁棒性 训练 系统 分类 结合 注意力 网络
1053,带置信度的多标记图像模型研究与应用,标记 cnn 模型 图像 分类 提出 置信 预测 胸片 mlicp
1054,巴州区降雨型滑坡预警研究,滑坡 巴州区 模型 降雨 研究 预警 地质灾害 发生 气象 进行
1055,电容型设备缺陷预测模型研究,数据 模型 算法 缺陷 设备 分类 研究 预测 特征 精度
1056,基于机器学习的MIMO系统收发机设计理论与方法,算法 信道 学习 mimo 系统 方法 性能 检测 无线通信 字典
1057,基于机器学习的布匹疵点检测算法研究,布匹 疵点 检测 实现 算法 会 分类 利用 衣物 企业
1058,基于数据分析与集成学习的4D航迹预测,航迹 模型 预测 error 聚类 使用 预处理 数据 学习 区
1059,单件小批量注塑模具高精加工过程刀具磨损预测,模具 刀具 加工 方法 过程 分析 模型 预测 精度 磨损
1060,基于机器学习算法的企业用电预测模型研究,数据 预测 企业 模型 算法 电力 检测 学习 结合 用电
1061,基于组分特征的tracrRNA识别和预测,tracrrna 分类器 训练 特征 rna 方法 酶 切割 特征选择 使用
1062,基于深度卷积循环神经网络的刀具状态监测技术研究,刀具 特征 利用 模型 铣削 加工 状态 进行 精度 磨损
1063,鱼种回波信号特征提取及分类方法研究,方法 鱼种 回波 评估 分类 进行 性能 特征 分析 卷积
1064,Object Detection and Recognition Techniques for Indoor Scene Using Deep ConvNets,accuracy techniques time proposed detection learning indoor data object real
1065,基于深度神经网络集成和信息论学习的时间序列预测,数据 模型 研究 深度 时间 学习 预测 神经网络 改进 集成
1066,基于机器学习构建数字化诊脉系统的应用研究,脉象 妊娠 中医 特征 传统 模型 研究 体系 方面 方法
1067,深度学习算法的FPGA硬件加速研究与实现,fpga 研究 上 模型 深度 进行 计算 算法 学习 cnn
1068,基于机器学习算法的光伏电站故障诊断研究,电站 光伏 遮挡 算法 数据 故障 验证 运行 进行 方法
1069,大规模物联网设备的识别与定位,信息 设备 论文 定位 物 识别 算法 网络空间 地标 地理位置
1070,边缘计算下无线通信接入认证技术研究,认证 接入 物理层 算法 节点 进行 模型 技术 适应 信道
1071,基于局部特征的人体重识别技术研究,模型 特征 方法 网络 进行 上 识别 行人 学习 序列
1072,面向SDN网络的DoS攻击检测与防御方法的研究,攻击 dos sdn 方法 流表 进行 特征 网络 ddos 检测
1073,基于机器学习的地质统计学随机建模方法研究,地质 方法 插值 点 进行 聚类 考虑 建模 计算 属于
1074,数据挖掘支撑下的城市功能区识别研究,数据 城市用地 模型 城市 出行 分析 进行 土地 技术 理解
1075,FPSO软刚臂单点系泊系统智能损伤识别研究,结构 进行 方法 损伤 识别 参数 利用 特征 软刚臂 单点系泊
1076,非均衡数据处理算法的研究与应用,数据 算法 分类 方法 技术 学习 不 研究 抽样 使
1077,支持汽车配件销售预测的方法研究与实现,汽车配件 企业 预测 配件 数据 协同 抽取 问题 特征 汽车
1078,基于中医症状的方药功用预测分析研究,中医 疾病 数据 算法 症状 功用 辩证 方剂 研究 医生
1079,面向微博文本的命名实体识别方法研究,实体 文本 提出 方法 进行 识别 词 模型 规范化 向量
1080,基于机器学习方法的彩票终端机异常检测,彩票 检测 社会 终端机 方法 机构 模型 数据 发行 销售点
1081,基于NLOS误差识别与消除的TOA无线定位算法研究,nlos 进行 算法 定位精度 研究 信号 分析 误差 应用 识别
1082,面向脑网络的特征选择方法研究及应用,网络 脑 方法 信息 特征选择 学习 阈值 构建 图核 数据
1083,基于隐式随机梯度下降法的研究,方法 参数 法 会 优化 问题 统计 学习 研究 进行
1084,多模数据驱动的胃癌筛查智能辅助决策方法研究,胃癌 方法 胃镜 筛查 语义 数据 问题 算法 敏感性 endo
1085,LHC/ALICE实验中奇异开粲强子信号的研究,中 强子 物质 研究 信号 碰撞 特性 ds 相互作用 粒子
1086,基于深度学习的超材料电磁仿真技术研究,超 进行 特性 电磁 材料 学习 构建 结构 研究 神经网络
1087,基于集成学习模型下的蛋白质交互作用预测方法研究,方法 相互作用 蛋白质 中 配体 数据 模型 预测 度量 过程
1088,基于fMRI动态功能网络的智商个体差异研究,特征 智商 研究 动态 预测 功能 开展 连接 分析 算法
1089,有机化合物对水生生物毒性的预测方法研究,模型 预测 水生 数据 结构 生物 建立 研究 急性毒性 有机
1090,基于矩阵分解算法的改进及在长非编RNA调控预测中的应用研究,预测 模型 生物 rna 相似性 长非 关系 用户 信息 正则
1091,生物关联预测算法的系统分析和应用研究,算法 关联 生物 预测 研究 数据 当前 领域 应用 疾病
1092,地学空间数据三维可视化关键算法研究及软件研发,地学 模型 空间 可视化 研究 空间数据 算法 设计 分析 特点
1093,基于随机森林的湟水流域土地利用/土地覆被变化检测,面积 土地利用 精度 分类 研究 数据 影像 湟水 流域 分区
1094,云环境基于属性约简与贝叶斯的气象数据分析,气象 数据 方法 分析 传统 大 运算 设计 算法 实验
1095,基于机器学习的全天空极光图像分类与割方法研究,极光 分割 图像 分类 研究 网络 模型 进行 空间 学习
1096,基于化学芯片技术的混合氨基酸ML识别的实验研究,氨基酸 进行 研究 反应 技术 芯片 化学 分析 混合 关系
1097,锂离子电池极板冲裁毛刺的成形机理及对电池失效行为影响的研究,电池 冲裁 影响 模型 极板 使用 进行 毛刺 流体 研究
1098,基于支持向量机与模糊贝叶斯方法的煤矿事故致因研究,煤矿 致 事故 进行 模型 算法 分析 应用 生产 方法
1099,基于深度迁移学习的数控系统领域技术术语识别,技术 术语 领域 专利 识别 数控系统 化 文档 迁移 文献
1100,基于半监督机器学习的数控机床领域关键技术识别研究,识别 领域 知识 专家 数控机床 提出 融合 战略 关键技术 进行
1101,基于残差卷积网和支持向量机的机器人铣削颤振辨识研究,机器人 颤振 振动 辨识 算法 铣削 模型 软件 进行 建立
1102,基于智能床垫的睡眠检测系统,睡眠 数据 人体 动作 进行 检测 信号 呼吸 算法 重构
1103,基于深度学习的烤烟分选算法研究,烟叶 数据 学习 特征 训练 方法 分选 样本 分级 优化
1104,一种相似青梅品级半监督智能认知方法研究,认知 样本 水果 相似 分拣 获取 空间 特征 神经网络 学习
1105,基于视频的复杂场景火灾检测技术研究,火灾 视频 技术 进行 检测 目标 算法 火焰 识别 研究
1106,基于数据挖掘的典型车辆排放因子预测研究,机动车 交通 模型 预测 排放 进行 效果 提供 因子 给出
1107,水相铜、镍、汞联合毒性HTE的检测技术研究,检测 溶液 毒性 进行 研究 芯片 联合 混合 生物化学 污染
1108,基于生成对抗网络的遥感图像场景分类研究,分类 gan 方法 学习 生成 特征提取 数据 提高 特征 图像
1109,基于IASE的铸件打磨粉尘治理装置设计,装置 分析 创新 求解 进行 工具 使用 iase 问题 粉尘
1110,基于退化模型复原与卷积神经网络的光学元器件损伤在线检测技术研究,进行 技术 检测 方法 图像 损伤 分类器 复原 图像处理 光学
1111,民航旅客个体出行价值预测应用研究,旅客 价值 模型 预测 方式 tmvp 市场 消费 能够 衡量
1112,面向飞行器自主着舰问题的行动者-评论家算法模型研究与实现,舰 算法 环境 模型 研究 学习 强化 行动者 应用 问题
1113,基于协同学和迁移学习的无人机避障系统的设计与实现,无人机 检测 学习 目标 神经网络 使 实现 进行 避障 模型
1114,机器人加工轨迹高精度控制研究,机器人 轮廓 控制 模型 进行 加工 控制器 关节 误差 设计
1115,基于机器学习的高速铁路无线信道多径分量聚簇研究,簇 高铁 进行 算法 无线 系统 数据 聚 完成 高速铁路
1116,基于集成学习的列车能耗预测方法研究及系统设计,能耗 数据 列车 货运 预测 学习 理论 集成 提供 实现
1117,基于改进型卷积神经网络的动车组滚动轴承故障诊断方法研究,动车组 故障 模型 数据 智能 诊断模型 轴承 cnn 使用 研究
1118,基于机器学习的高铁开行方案编制方法研究,高铁 算法 方法 方案 数据 编制 模型 学习 问题 研究
1119,关于公路货运详情页的推荐模型研究与应用,模型 货物 推荐 研究 信息 物流 算法 生活 auc 召回
1120,基于重点营运车辆数据的高速公路交通状态识别与行程速度预测,数据 预测 算法 车辆 行程 验证 优化 进行 高速公路 实现
1121,基于阿里云大数据平台的交通运输综合行政执法案件的智能分析和研究,模型 行政 违法 交通运输 特征 分类 预测 案件 平台 建立
1122,基于机器学习方法的打车需求量预测研究,预测 进行 打车 模型 乘客 系统 提升 需求量 研究 特征
1123,基于机器学习混凝土路面裂缝检测算法研究,裂缝 学习 算法 进行 识别 检测 传统 算子 样本 使用
1124,基于嵌入式的智能车载终端研究与实现,导航 问题 定位 导航仪 卫星 算法 研究 车载 交互 小
1125,基于视觉的驾驶员情绪识别研究,驾驶员 模型 情绪 表情 状态 识别 方法 研究 实验 驾驶
1126,纯电动汽车和燃油汽车的社会生命周期评价,社会 产品 评价 汽车 数据 企业 持续 发展 纯 互联网
1127,基于社区问答文本的汽车知识问答系统研究,汽车 系统 问答 研究 用户 企业 文本 答案 算法 进行
1128,机器学习在智能家居监控系统中的应用,图像 进行 特征 摔倒 家庭 算法 运动 监控 检测 分析
1129,建筑物爆破拆除塌落振动效应初探,进行 爆破 合理 拆除 振动 分析 塌落 能量 利用 得到
1130,基于频率和光纤光栅识别纤维增强复合材料梁的分层损伤,识别 损伤 frp 分层 进行 算法 参数 案例 验证 层合梁
1131,基于长短期记忆网络的制冷剂剩余量的预测研究,模型 预测 数据 制冷剂 lstm 维护 进行 使用 空调 稳态
1132,基于机器学习的办公建筑暖通空调系统能耗预测及优化调度,能耗 进行 能源 优化 数据 建筑 利用 算法 预测 空调
1133,电力巡检中的小样本机器学习方法研究,算法 小 方法 训练 巡检 样本 差异 网络 分类 模型
1134,同步型分布式电源的被动式孤岛检测方法研究,检测 模型 孤岛 分布式 方法 迁移 得到 分析 能源 进行
1135,电能计量装置故障诊断与状态评估建模研究,故障 评估 进行 电能 校验 装置 状态 监测 公司 运行
1136,基于深度学习的中文电子病历实体及其修饰识别技术研究,医疗 病历 实体 信息 进行 电子 识别 使用 文本 cnn
1137,基于sentence2vec的疾病提前诊断和风险预测,进行 患者 数据 ehr 医疗 医疗保健 记录 疾病 方法 预测
1138,MSM人群PrEP服药依从性的预测模型研究,依从性 研究 模型 因素 预测 进行 hiv msm 提高 性伴
1139,护理领域命名实体抽取方案研究,护理 老人 进行 实体 抽取 文献 命名 使用 模型 特征
1140,基于MRI影像组学分析对乳腺癌新辅助化疗病理缓解早期术前预测,rl 病理 乳腺癌 特征 预测 mri 模型 灰度 验证 roc
1141,阿尔茨海默病与遗忘型轻度认知障碍患者磁共振脑功能及影像组学研究,海马 fc 特征 患者 影像 mci 功能 模型 中 方法
1142,影像组学在鼻咽癌靶区勾画部分问题中的初步应用研究,鼻咽癌 肿瘤 影像 研究 分析 淋巴结 特征 数据 鉴别 方法
1143,磁共振3D纹理分析应用于胶质母细胞瘤和原发性中枢淋巴瘤的术前鉴别诊断,纹理 分析 参数 图像 方法 患者 曲线 诊断 肿瘤 形态
1144,基于图像处理的糖尿病视网膜病变辅助诊断研究,诊断 病变 算法 糖尿病 方法 分割 视力 图像 提取 dr
1145,基于机器学习的鼻咽癌放射治疗自动计划,计划 病例 nn 鼻咽癌 自动 左右侧 手工 gtv 研究 ovh
1146,集成学习算法在细胞毒性预测方面的研究与实现,预测 毒性 模块 数据 方法 算法 集成 细胞 造成 系统
1147,基于多维度特征与随机森林的对外汉语文本可读性评估,可读性 特征 学习 文本 研究 对外汉语 阅读 特征选择 训练 实验
1148,基于第二十一届成都国际汽车展览会的数据挖掘,汽车 品牌 进行 车展 产品 名称 提供 汽车品牌 使用 新闻
1149,基于L1正则化Logistic回归模型的P2P网络贷款风险测度应用研究,平台 借贷 风险 贷款 进行 p2p 研究 测度 logistic 数据
1150,在线协作学习（CSCL）平台的研究与实现,平台 学习者 学习 cscl 实现 提升 算法 研究 笔记 设计
1151,网络学习空间在线讨论语义分析工具的实现与应用,研究 分析 工具 数据 应用 学习 教育 语义 网络 教学
1152,基于传统课堂的教师话语情感识别研究,特征 教师 情感 传统 方法 识别 课堂 语料库 提取 实验
1153,基于修辞使用的小学作文自动分类评价方法研究,方法 作文 进行 分类 自动 研究 评价 学习 写 textrank
1154,小学人工智能教育机器人的设计与应用研究,人工智能 教育 小学 发展 教学 机器人 软件 语音 问卷调查 中小学
1155,基于深度学习的学生课堂行为识别,训练 学生 行为 图像 学习 模型 数据 进行 识别 检测
1156,频谱共享网络动态资源管理算法研究,干扰 频谱 基站 算法 进行 无线 数量 用户 主 累积
1157,空天地一体化网络无线资源管理与传输协议优化研究,通信 网络 能效 混合 策略 分配 提出 系统 用户 天线
1158,基于移动蜂窝网络的位置指纹室内定位,定位 算法 数据 距离 distance 影响 进行 wknn 指纹 提高
1159,基于设备指纹的无线设备识别研究,身份 设备 合法 差分 识别 信号 用户 进行 无线网络 利用
